description,event_count,Address,followers_count,Time,Title,Organizer
After the tremendous super success of milestones Ree-Ytal Consultancy announces its next batch of Super Power Train the Trainer Certification Programme from 1-3 December in New Delhi.,1 Events,"Hotel Bharat continental R-548, New Rajinder Nagar, Main shankar road, New Delhi, Delhi - 110060, India",0 Followers,Fri Dec 01 2017 at 09:30 am to Sun Dec 03 2017 at 06:00 pm,Train the Trainer Workshop,Ercess Live
"After hosting 400+ successful events in Russia, Ukraine, Azerbaijan, Kazakhstan and South Africa, Arts of India Expo, a leading event and exhibition is coming with The Hashtag Fest. ",0 Events,"Ansal Plaza, South Ex, South Ex, New Delhi, India",11 Followers,Fri Nov 17 2017 at 11:00 am,The Hashtag Fest,The Hashtag Fest
"Delhi Police&Ladli Foundation together organizing AUniqueHalf-Marathon for cause ""RUNforLAADLI”) on 17thDecember, 2017 (Sunday) From JLN Stadium New Delhi to Central Park CP. Via India Gate (Rajpath) ",1 Events,"Jawaharlal Nehru Stadium, Lodhi Road, New Delhi, India",34 Followers,Sun Dec 17 2017 at 07:00 am to 03:00 pm,Run For Laadli ( A Unique Half Marathon by Delhi Police),Laadli Foundation Trust
description,event_count,Address,followers_count,Time,Title,Organizer
"Delhi Police&Ladli Foundation together organizing AUniqueHalf-Marathon for cause ""RUNforLAADLI”) on 17thDecember, 2017 (Sunday) From JLN Stadium New Delhi to Central Park CP. Via India Gate (Rajpath) ",1 Events,"Jawaharlal Nehru Stadium, Lodhi Road, New Delhi, India",34 Followers,Sun Dec 17 2017 at 07:00 am to 03:00 pm,Run For Laadli ( A Unique Half Marathon by Delhi Police),Laadli Foundation Trust
